{
  "$schema": "https://json-schema.org/draft/2020-12/schema",
  "$id": "https://psu.ac.th/schemas/automated-video-assembly-workflow-v1.json",
  "title": "Automated Video Assembly Workflow",
  "type": "object",
  "additionalProperties": false,
  "required": ["schemaVersion", "id", "steps"],
  "properties": {
    "$schema": { "type": "string" },
    "schemaVersion": { "const": 1 },
    "id": { "type": "string", "minLength": 1, "pattern": "^[A-Za-z0-9_-]+$" },
    "name": { "type": "string" },
    "variables": { "type": "object" },
    "settings": {
      "type": "object",
      "properties": {
        "runRoot": { "type": "string" },
        "stepTimeoutMs": { "type": "integer", "minimum": 1000 },
        "retryAttempts": { "type": "integer", "minimum": 1 },
        "pollIntervalMs": { "type": "integer", "minimum": 100 },
        "services": { "type": "object" },
        "adobe": { "type": "object" }
      },
      "additionalProperties": true
    },
    "steps": {
      "type": "array",
      "minItems": 1,
      "items": { "$ref": "#/$defs/step" }
    }
  },
  "$defs": {
    "step": {
      "type": "object",
      "additionalProperties": false,
      "required": ["id", "type"],
      "properties": {
        "id": { "type": "string", "minLength": 1, "pattern": "^[A-Za-z0-9_-]+$" },
        "type": {
          "enum": [
            "asset.select",
            "asset.multi_select",
            "asset.batch_folder",
            "image.removeBackground",
            "image.resize",
            "image.luma_to_alpha",
            "graphics.cover_title",
            "template.payload",
            "llm.chat",
            "comfyui.workflow",
            "ae.template",
            "ae.render",
            "effect.3d_carousel",
            "premiere.assemble",
            "media.probe",
            "timeline.scene",
            "timeline.transition",
            "timeline.overlay",
            "timeline.graphic_mogrt",
            "timeline.dynamic_link",
            "timeline.compose",
            "audio.asset",
            "audio.jaitts",
            "audio.mix",
            "media.audio_normalize",
            "premiere.build",
            "premiere.export",
            "storyboard.docx_import",
            "media.catalog",
            "edit.cutlist",
            "editor.broll_match",
            "review.approval",
            "review.media_approval",
            "media.conform",
            "timeline.broll_stack",
            "audio.dialogue_mix",
            "audio.loudness_qc",
            "graphics.template_card",
            "qc.timeline",
            "audio.smart_ducking",
            "video.color_grade",
            "video.split_screen_2box",
            "layout.side_by_side",
            "video.smart_reframe",
            "graphics.news_strap",
            "graphics.lower_third",
            "graphics.ticker_crawl",
            "graphics.countdown_timer",
            "audio.beat_detect",
            "effect.zoom_callout",
            "vision.slide_detect",
            "ae.channel_id_bumper",
            "ae.program_rundown",
            "ae.kinetic_titles",
            "ae.speech_visualizer",
            "graphics.kpi_dashboard",
            "graphics.process_graph",
            "ae.device_mockup_3d",
            "ae.saas_tour_cursor",
            "effect.cinematic_title",
            "graphics.social_sticker_pack",
            "comfyui.archival_restore",
            "ae.ai_parallax_25d",
            "prompt.scientific_conditioning",
            "comfyui.scientific_motion",
            "ae.volumetric_particles_3d",
            "graphics.scientific_hud",
            "comfyui.controlnet_style_transfer",
            "ae.cyberpunk_vfx",
            "comfyui.latent_morph",
            "ae.caustics_fluid_diffusion",
            "ar.floating_slides_3d",
            "ar.camera_movement_3d",
            "util.switch_branch",
            "util.coalesce_fallback",
            "util.string_formatter",
            "util.json_query_extract",
            "util.media_transcode",
            "util.audio_extract",
            "util.lossless_trim",
            "util.timecode_math",
            "util.duration_pad",
            "util.data_inspector_qc",
            "util.file_integrity_guard",
            "typography.custom_render",
            "caption.generate",
            "preview.media",
            "preview.video",
            "preview.image"
          ]
        },
        "name": { "type": "string" },
        "enabled": { "type": "boolean", "default": true },
        "timeoutMs": { "type": "integer", "minimum": 1000 },
        "retry": {
          "type": "object",
          "properties": {
            "attempts": { "type": "integer", "minimum": 1 },
            "delayMs": { "type": "integer", "minimum": 0 }
          },
          "additionalProperties": false
        },
        "with": { "type": "object" }
      }
    }
  }
}
